{
  "$schema": "../schema/jquery-mobile-migration.schema.json",
  "schemaVersion": 1,
  "reviewedAt": "2026-09-24T04:32:00Z",
  "policy": {
    "ecosystemSha256": "2b6550a824aa495c58f21948260a6ab504e9da355072aca8cd8999a06f8cb718",
    "runtime": "absent",
    "fixtureRuntime": "forbidden",
    "defaultNavigation": "full-document",
    "historicalPackage": {
      "name": "jquery-mobile",
      "version": "1.4.1",
      "integrity": "sha512-5CIKR+jQ34GMNz8vGpiNIxQ2zfmEXpbCI0hFfyHYi/MDhdkJLpk2lFl2txjPxkAbHSvJLntNJgS//OrA1nBIkg==",
      "shasum": "4c5eaf3d20f99973d1481ed4c9c8921d016fe198",
      "usage": "identity-only"
    },
    "modernPackages": {
      "jquery": {
        "version": "4.0.0",
        "integrity": "sha512-TXCHVR3Lb6TZdtw1l3RTLf8RBWVGexdxL6AC8/e0xZKEpBflBsjh9/8LXw+dkNFuOyW9B7iB3O1sP7hS0Kiacg==",
        "shasum": "95c33ac29005ff72ec444c5ba1cf457e61404fbb"
      },
      "jqueryStar": {
        "version": "1.1.0",
        "proof": "exact-quality-tarball"
      }
    }
  },
  "sources": [
    {
      "id": "mobile.openjs-status",
      "kind": "status",
      "url": "https://github.com/openjs-foundation/cross-project-council",
      "reviewedAt": "2026-09-04T16:30:00Z"
    },
    {
      "id": "mobile.archive",
      "kind": "maintenance",
      "url": "https://github.com/jquery-archive/jquery-mobile",
      "reviewedAt": "2026-09-04T16:30:00Z"
    },
    {
      "id": "mobile.deprecation",
      "kind": "maintenance",
      "url": "https://blog.jquerymobile.com/2021/10/07/jquery-maintainers-continue-modernization-initiative-with-deprecation-of-jquery-mobile/",
      "reviewedAt": "2026-09-04T16:30:00Z"
    },
    {
      "id": "mobile.api-1.4",
      "kind": "api",
      "url": "https://api.jquerymobile.com/1.4/category/all/",
      "reviewedAt": "2026-09-04T16:30:00Z"
    },
    {
      "id": "mobile.data-attributes",
      "kind": "data-attributes",
      "url": "https://api.jquerymobile.com/1.4/data-attribute/",
      "reviewedAt": "2026-09-04T16:30:00Z"
    },
    {
      "id": "mobile.demos-1.4.5",
      "kind": "demos",
      "url": "https://demos.jquerymobile.com/1.4.5/",
      "reviewedAt": "2026-09-04T16:30:00Z"
    },
    {
      "id": "mobile.transitions",
      "kind": "demos",
      "url": "https://demos.jquerymobile.com/1.4.5/transitions/",
      "reviewedAt": "2026-09-04T16:30:00Z"
    },
    {
      "id": "mobile.upgrade-1.4",
      "kind": "upgrade",
      "url": "https://jquerymobile.com/upgrade-guide/1.4/",
      "reviewedAt": "2026-09-04T16:30:00Z"
    },
    {
      "id": "jquery.core-upgrade-4",
      "kind": "core-upgrade",
      "url": "https://jquery.com/upgrade-guide/4.0/",
      "reviewedAt": "2026-09-04T16:30:00Z"
    },
    {
      "id": "jquery.migrate",
      "kind": "migrate",
      "url": "https://github.com/jquery/jquery-migrate/blob/main/README.md",
      "reviewedAt": "2026-09-04T16:30:00Z"
    },
    {
      "id": "mobile.npm-1.4.1",
      "kind": "package",
      "url": "https://registry.npmjs.org/jquery-mobile/-/jquery-mobile-1.4.1.tgz",
      "reviewedAt": "2026-09-04T16:30:00Z"
    }
  ],
  "owners": [
    "native-html",
    "native-css",
    "jqstar-component",
    "application-code",
    "datastar-sdk",
    "turbo-bridge",
    "htmx-bridge",
    "full-document",
    "unsupported"
  ],
  "apiInventory": [
    {
      "id": "api.button",
      "title": "Button Widget",
      "category": "widgets",
      "url": "https://api.jquerymobile.com/1.4/button/",
      "groupId": "buttons"
    },
    {
      "id": "api.buttonMarkup",
      "title": ".buttonMarkup()",
      "category": "methods",
      "url": "https://api.jquerymobile.com/1.4/buttonMarkup/",
      "groupId": "buttons"
    },
    {
      "id": "api.checkboxradio",
      "title": "Checkboxradio Widget",
      "category": "widgets",
      "url": "https://api.jquerymobile.com/1.4/checkboxradio/",
      "groupId": "form-choice"
    },
    {
      "id": "api.classes",
      "title": "Classes",
      "category": "css-framework",
      "url": "https://api.jquerymobile.com/1.4/classes/",
      "groupId": "theme-icons"
    },
    {
      "id": "api.collapsible",
      "title": "Collapsible Widget",
      "category": "widgets",
      "url": "https://api.jquerymobile.com/1.4/collapsible/",
      "groupId": "disclosure"
    },
    {
      "id": "api.collapsibleset",
      "title": "Collapsibleset Widget",
      "category": "widgets",
      "url": "https://api.jquerymobile.com/1.4/collapsibleset/",
      "groupId": "disclosure"
    },
    {
      "id": "api.controlgroup",
      "title": "Controlgroup Widget",
      "category": "widgets",
      "url": "https://api.jquerymobile.com/1.4/controlgroup/",
      "groupId": "buttons"
    },
    {
      "id": "api.data-attribute",
      "title": "Data Attributes",
      "category": "reference",
      "url": "https://api.jquerymobile.com/1.4/data-attribute/",
      "groupId": "auto-enhancement"
    },
    {
      "id": "api.dialog",
      "title": "Dialog Widget",
      "category": "widgets",
      "url": "https://api.jquerymobile.com/1.4/dialog/",
      "groupId": "overlays"
    },
    {
      "id": "api.enhanceWithin",
      "title": ".enhanceWithin()",
      "category": "methods",
      "url": "https://api.jquerymobile.com/1.4/enhanceWithin/",
      "groupId": "auto-enhancement"
    },
    {
      "id": "api.fieldcontain",
      "title": ".fieldcontain()",
      "category": "methods",
      "url": "https://api.jquerymobile.com/1.4/fieldcontain/",
      "groupId": "form-layout"
    },
    {
      "id": "api.filterable",
      "title": "Filterable Widget",
      "category": "widgets",
      "url": "https://api.jquerymobile.com/1.4/filterable/",
      "groupId": "lists"
    },
    {
      "id": "api.fixedtoolbar",
      "title": "Fixedtoolbar Widget",
      "category": "widgets",
      "url": "https://api.jquerymobile.com/1.4/fixedtoolbar/",
      "groupId": "toolbars"
    },
    {
      "id": "api.flipswitch",
      "title": "Flipswitch Widget",
      "category": "widgets",
      "url": "https://api.jquerymobile.com/1.4/flipswitch/",
      "groupId": "form-range"
    },
    {
      "id": "api.footer",
      "title": "Footer Widget",
      "category": "widgets",
      "url": "https://api.jquerymobile.com/1.4/footer/",
      "groupId": "toolbars"
    },
    {
      "id": "api.global-config",
      "title": "Configuring Defaults",
      "category": "reference",
      "url": "https://api.jquerymobile.com/1.4/global-config/",
      "groupId": "auto-enhancement"
    },
    {
      "id": "api.grid-layout",
      "title": "Grid Layout",
      "category": "css-framework",
      "url": "https://api.jquerymobile.com/1.4/grid-layout/",
      "groupId": "responsive-layout"
    },
    {
      "id": "api.hashchange",
      "title": "hashchange",
      "category": "events",
      "url": "https://api.jquerymobile.com/1.4/hashchange/",
      "groupId": "navigation-history"
    },
    {
      "id": "api.header",
      "title": "Header Widget",
      "category": "widgets",
      "url": "https://api.jquerymobile.com/1.4/header/",
      "groupId": "toolbars"
    },
    {
      "id": "api.icons",
      "title": "Icons",
      "category": "jqmicons",
      "url": "https://api.jquerymobile.com/1.4/icons/",
      "groupId": "theme-icons"
    },
    {
      "id": "api.jqmData",
      "title": "jqmData()",
      "category": "methods",
      "url": "https://api.jquerymobile.com/1.4/jqmData/",
      "groupId": "data-storage"
    },
    {
      "id": "api.jqmEnhanceable",
      "title": "jqmEnhanceable()",
      "category": "methods",
      "url": "https://api.jquerymobile.com/1.4/jqmEnhanceable/",
      "groupId": "auto-enhancement"
    },
    {
      "id": "api.jqmHijackable",
      "title": "jqmHijackable()",
      "category": "methods",
      "url": "https://api.jquerymobile.com/1.4/jqmHijackable/",
      "groupId": "auto-enhancement"
    },
    {
      "id": "api.jqmRemoveData",
      "title": ".jqmRemoveData()",
      "category": "methods",
      "url": "https://api.jquerymobile.com/1.4/jqmRemoveData/",
      "groupId": "data-storage"
    },
    {
      "id": "api.jQuery.mobile.activePage",
      "title": "jQuery.mobile.activePage",
      "category": "properties",
      "url": "https://api.jquerymobile.com/1.4/jQuery.mobile.activePage/",
      "groupId": "page-framework"
    },
    {
      "id": "api.jQuery.mobile.changePage",
      "title": "jQuery.mobile.changePage()",
      "category": "methods",
      "url": "https://api.jquerymobile.com/1.4/jQuery.mobile.changePage/",
      "groupId": "navigation-history"
    },
    {
      "id": "api.jQuery.mobile.degradeInputsWithin",
      "title": "jQuery.mobile.degradeInputsWithin()",
      "category": "methods",
      "url": "https://api.jquerymobile.com/1.4/jQuery.mobile.degradeInputsWithin/",
      "groupId": "form-text"
    },
    {
      "id": "api.jQuery.mobile.getDocumentBase",
      "title": "jQuery.mobile.getDocumentBase()",
      "category": "methods",
      "url": "https://api.jquerymobile.com/1.4/jQuery.mobile.getDocumentBase/",
      "groupId": "url-utils"
    },
    {
      "id": "api.jQuery.mobile.getDocumentUrl",
      "title": "jQuery.mobile.getDocumentUrl()",
      "category": "methods",
      "url": "https://api.jquerymobile.com/1.4/jQuery.mobile.getDocumentUrl/",
      "groupId": "url-utils"
    },
    {
      "id": "api.jQuery.mobile.getInheritedTheme",
      "title": "jQuery.mobile.getInheritedTheme()",
      "category": "methods",
      "url": "https://api.jquerymobile.com/1.4/jQuery.mobile.getInheritedTheme/",
      "groupId": "theme-icons"
    },
    {
      "id": "api.jQuery.mobile.loadPage",
      "title": "jQuery.mobile.loadPage()",
      "category": "methods",
      "url": "https://api.jquerymobile.com/1.4/jQuery.mobile.loadPage/",
      "groupId": "navigation-history"
    },
    {
      "id": "api.jQuery.mobile.navigate",
      "title": "jQuery.mobile.navigate()",
      "category": "methods",